{
    "$schema": "http://json-schema.org/draft-07/schema#",
    "$id": "input-dataset-info.schema.json",
    "title": "Input dataset info `dataset.json`",
    "description": "File containing the data needed to process a dataset. If single dataset, should be at the highest folder level. If one of many in a group of datasets, should be in a subfolder pointed to by the megaset JSON `datasets` array. Should be named `dataset.json`",
    "type": "object",
    "additionalProperties": false,
    "properties": {
        "title": {
            "description": "Display name of the dataset",
            "type": "string"
        },
        "name": {
            "description": "Name of the dataset (no version number)",
            "type": "string"
        },
        "version": {
            "description": "version year and number",
            "type": "string"
        },
        "description": {
            "description": "Description of the dataset",
            "type": "string"
        },
        "image": {
            "description": "relative path to the dataset card image file",
            "type": "string"
        },
        "link": {
            "description": "Link to website displaying the dataset",
            "type": "string"
        },
        "userData": {
            "description": "Optional display data",
            "type": "object"
        },
        "production": {
            "description": "Whether this dataset should only be shown in production",
            "type": "boolean"
        },
        "featuresDataPath": {
            "description": "url to the per cell data json",
            "type": "string"
        },
        "featureDefsPath": {
            "description": "path to the feature def collection",
            "type": "string"
        },
        "viewerSettingsPath": {
            "description": "path to image per-channel settings for the 3d viewer",
            "type": "string"
        },
        "albumPath": {
            "description": "collection name of the album data",
            "type": "string"
        },
        "thumbnailRoot": {
            "description": "Root url for thumbnail images",
            "type": "string"
        },
        "downloadRoot": {
            "description": "Root url for downloading cell data",
            "type": "string"
        },
        "volumeViewerDataRoot": {
            "description": "Root url for 3d images",
            "type": "string"
        },
        "xAxis": {
            "description": "Settings for the x axis",
            "type": "object",
            "$ref": "sub-schema/selection-setting.schema.json"
        },
        "yAxis": {
            "description": "Settings for the y axis",
            "type": "object",
            "$ref": "sub-schema/selection-setting.schema.json"
        },
        "colorBy": {
            "description": "Settings for the color by menu",
            "type": "object",
            "$ref": "sub-schema/selection-setting.schema.json"
        },
        "groupBy": {
            "description": "Settings for the grouping menu",
            "type": "object",
            "$ref": "sub-schema/selection-setting.schema.json"
        },
        "featuresDisplayOrder": {
            "description": "Ordered array of feature keys for display on front end",
            "type": "array",
            "items": {
                "type": "string"
            }
        },
        "featuresDataOrder": {
            "description": "Ordered array of feature keys for packing and unpacking data",
            "type": "array",
            "items": {
                "type": "string"
            }
        }
    },
    "required": [
        "title",
        "version",
        "name",
        "image",
        "description",
        "featuresDataPath",
        "viewerSettingsPath",
        "albumPath",
        "thumbnailRoot",
        "downloadRoot",
        "volumeViewerDataRoot",
        "xAxis",
        "yAxis",
        "groupBy",
        "colorBy",
        "featuresDisplayOrder",
        "featuresDataOrder"
    ]
}