{
  "title": "Interphase (i1) and prophase (m1) shape-matched cells",
  "version": "1",
  "name": "variance_i1m1",
  "image": "",
  "description": "Dataset of shape matched interphase and prophase cells.",
  "userData": {
    "isNew": true,
    "inReview": false,
    "totalCells": 4170,
    "totalFOVs": 0,
    "totalTaggedStructures": 25
  },
  "featureDefsPath": "feature_defs.json",
  "featuresDataPath": "cell_feature_analysis.json",
  "viewerSettingsPath": "images.json",
  "albumPath": "albums",
  "thumbnailRoot": "https://s3-us-west-2.amazonaws.com/bisque.allencell.org/v2.0.0/Cell-Viewer_Thumbnails",
  "downloadRoot": "https://files.allencell.org/api/2.0/file/download?collection=cellviewer-2-0",
  "volumeViewerDataRoot": "https://s3-us-west-2.amazonaws.com/bisque.allencell.org/v2.0.0/Cell-Viewer_Thumbnails",
  "xAxis": {
    "default": "cell-volume",
    "exclude": ["cell-line"]
  },
  "yAxis": {
    "default": "dna-volume",
    "exclude": ["cell-line"]
  },
  "colorBy": {
    "default": "cell-line"
  },
  "groupBy": {
    "default": "cell-line"
  },
  "featuresDisplayOrder": [],
  "featuresDataOrder": [
    "cell-height",
    "cell-volume",
    "cell-surface-area",
    "dna-height",
    "dna-volume",
    "dna-surface-area",
    "intracellular-structure-volume",
    "anaphase-segmentation-complete",
    "interphase-or-mitosis",
    "interphase-and-mitotic-stages",
    "shape-mode-1",
    "shape-mode-2",
    "shape-mode-3",
    "shape-mode-4",
    "shape-mode-5",
    "shape-mode-6",
    "shape-mode-7",
    "shape-mode-8",
    "angle",
    "type",
    "neigh",
    "lda",
    "cell-line"
  ]
}
